name,more_detailed_summary
Nautilus by Arlo,"Nautilus by Arlo is a hotel rated 4.5 stars, located at 1825 Collins Ave, Miami Beach, FL 33139-7414. This hotel offers a range from $253 - $464 per night and is ranked #9 of 235 hotels in Miami Beach in Miami Beach. Among its amenities are standard amenities. It has a total of 250 rooms. Key highlights from guest reviews include: I go the reviews for the details.. We have a fantastic view of the sunrise every morning.. I would like to give an excellent review to Nautilus by Arlo.. Review tips
Beautiful hotel.. From customer service to the rooms, location, views and everything in between.. My friends and I stayed here for our reunion and I agree with all the previous reviews that the service is amazing.. This room has an ocean view but no balcony and it is a little bigger than the room that I booked.. Lunch review below‚Ä?
BEACH: Direct, easy access.. Delicious restaurant with pool view, awesome beach. The whole team on the beach is awesome Isaac will and Troy give the best service on the beach.. They know everybody‚Äôs name take good care of you and make sure your head is in the shade.. üòâ love the Nautilis hotel, and the team on the beach 
Let‚Äôs not forget Alexis, concierge extra ordinaire who made her stay extra special... I‚Äôve traveled a lot and the service Oscar provides is 5 star, that‚Äôs the vibe I want when I‚Äôm on vacation!. Oscar and Alexis treated us so warmly and were extremely helpful all week.. Isaac at the beach is a gem who also took great care of us.. Staff cares and goes above and beyond to make sure you‚Äôre having the best time and experience.. From the front desk staff, to the valet staff and the servers.. We were accommodated by Oscar who was nothing but helpful.. The wait staff Ariana, Lana, Lucy, Belen, and Giulia were absolutely amazing and helpful.. 10/10 Jackie as well‚Ä?great service for my entire stay.. Nautilus staff is incredibly accommodating.. Oscar, Jordan, Alexis, Issac, and Yusef are all beautiful people and took great care of us during our week long stay.. The customer service at Nautilus is top notch!. We‚Äôve never experienced service at this level.. Oscar, Jordan, Izak, Alexis,  Lana provided the best service ever.. Best service the front staff (Oscar) and the pool staff (Jordan&alexis&lucila) were so gracious to us.. Every staff member is exceptionally helpful and attentive.. We really appreciated the service.. Big Thanks to the wonderful staff of Arlo Nautilus for making our 20th Anniversary stay memorable!. Big shout outs to the extraordinary, amazing pool staff Jordan and Svetlana!. The staff is super friendly, incredibly helpful and are doing their best to make sure you have a great time.. Staff is excellent , hotel is well maintained and love the pool.. Spent most of time at the beach , loved the staff there too!. She took such great care of me I will come back to the hotel just for her as she‚Äôs that good.. Buffet breakfast at this hotel was 33 UDS pkus service charge of 14% and then tax of course.. Good service.. Thank you so much for all your hard work üòì 
I am very happy with that service especially for Isaac , omg he remembers all tourist name 
He is amazing with his customer service skills ü§©also Wilkelnson , he did find my cell that I lost on the beach 
Thank you üôèüèº. It has a nice vibe at the pool and helpful and friendly staff.. AJ took extra care and homework was done in advance to make sure I felt welcome.. I would definitely come back here, the staff is so superb.. I have to give a shout out to Wilkenson from the beach staff.. Great customer service!. From the moment I arrived there was a smile on every staff members face.. Staff was excellent at the pool, the beach, the restaurant,etc.. Some of the best service I‚Äôve ever had, extremely nice person and made me feel valued.. Isaac and Belen
Provided the beast beach side service.. The staff could not have been kinder and they made a very stressful situation a lot better.. | specifically want to thank pool/ cabana staff.. They took care of us for the day at the pool, and made the experience special.. Super clean and extremely friendly staff.. We checked into the hotel and we‚Äôre immediately greeted with the best hospitality, expediting our room availability and setting us up at the pool.. Everyone was so helpful and kind, making our weekend amazing.. The nautilus beach team was really helpful, wil took great care of us and the the hotel was amazing.t the food was great and can‚Äôt wait to come back.. Oscar was especially helpful and showed us several different room options so we could have our dream pick!. The amazing hospitality showed by Oscar and melody warmed my heart.. From customer service to the rooms, location, views and everything in between.. Special shout out to the valet manager Rolson St. Louis, Front desk attendant Alvin, front door attendant Abel  and server Edwin at the Cabana Club for their positive attitude, continuous smile, and exemplary customer service!. My friends and I stayed here for our reunion and I agree with all the previous reviews that the service is amazing.. I do admit that I removed some of the items in the mini fridge to make room for some of the things I purchased from CVS but everything I removed was carefully placed on the side of the minibar.. The front desk staff was super responsive and helped us find a more family friendly atmosphere down the beach!. STAFF: Helpful, warm, five-star service.. Oscar, Lana, Arianna, Melody, Tea, Giuliano, and Jackie take pride in this retro boutique hotel and provided world-class service.. The water was the perfect temperature, crystal clear, not crowded, tranquil, quality guests and very polished staff.. I‚Äôm sure this would be especially helpful at times when it‚Äôs near capacity - no awkward weaving through the chairs and scooting them around to fit your group.. Svetlana took excellent care of us and anticipated our every need.. We were married at Four Seasons The Biltmore Santa Barbara and the service level at Nautilus was beyond any Four Seasons we‚Äôve stayed at.. I would just improve the cleanliness of windows and elevators + the elevators are extremely slow ;) The staff is really helpful, though.. From the rooms to the front desk staff to the pool staff, everything was perfect.. The pool staff, Eva, Belen, Arianna and Jackie were so kind. For more information, visit https://www.arlohotels.com/nautilus/?utm_source=local-listings&utm_medium=organic&utm_campaign=yext-nautilus or check reviews online to learn more about guest experiences."
Nobu Hotel Miami Beach,"Nobu Hotel Miami Beach is a hotel rated 4.0 stars, located at 4525 Collins Ave, Miami Beach, FL 33140-3226. This hotel offers a range from $339 - $593 per night and is ranked #102 of 235 hotels in Miami Beach in Miami Beach. Among its amenities are standard amenities. It has a total of 206 rooms. Key highlights from guest reviews include: Between the facilities and the room this hotel was super clean and had incredible views.. The issues listed in this review may not seem like a big deal for most people, and they were not a big deal to us, but as a labeled 5 star hotel, these things matter.. We were not given a tour or even an overview of the resort.. We reviewed our check in as we were emailed to do within the first 24 hours of stay, and no one from management reached out to us.. Hotel location and staff were nice, you are right on the beach, the view is to die for.. Our room had an incredible view, but the bathroom only had 1 tiny sink with very little space to put my things and the shower was also tiny.. And one morning for an unknown reason we weren‚Äôt able to eat at the ocean view restaurant.. I feel a bit weird splashing this out on the internet for complete strangers to read, but it‚Äôs relevant to this review‚Ä?. I wish I had a better ocean view.. They upgraded us (without asking) to an amazing room with gorgeous ocean view on the eleventh floor.. Upon reviewing my emailed receipt, this was essentially a lie.. You see the view from you open the door.. The view from my balcony was amazing.. The view was amazing.. Great location and beautiful ocean view Suite, with beautiful view and great amenities in the suite.. I‚Äôm not one to ever leave reviews EVER, but a place like this with amazing people like Sabrina in the front desk?. I travel a lot and I‚Äôve never gone out of my way to write a bad review for a hotel and this is my first time.. Ocean views from my room are spectacular. The Nobu was great, Gaby went out of her way to make sure we were taken care of every day.. I will be back,  thank for taking such great care of us.. The front desk staff was attentive and accommodating.. I would highly recommend planning a special event at this beautiful property with the help of people who really care about their guests and their experience. The staff was very helpful everywhere.. Location good, services good, near beach.. We were treated with no respect, the staff is aggressive and unhelpful.. You pay more but you get real service and amazing experience.. Dirty, sticky tables in restaurant, lack of customer service.. Luckily, hotel staffed accommodated us and switched them to a main floor room which was more like a suite!. Pool service was terrible.. Having traveled to thousands of hotels in my lifetime, I am quite knowledgeable regarding the services provided by 5 star hotel, and what qualities are necessary for that label.. When you reach the hotel, several staff members will be there to open doors and direct arriving vehicles, but that‚Äôs about it.. None of these staff members helped us take our luggage out of the car, or carry it up the stairs into the lobby.. Bartenders at the ocean social bar and the other pool bar were not friendly and attentive despite the added service.. Staff here seems to be a bit flustered, it almost functions like the hotel opened last month.. The hotel was crowded and service was terrible, multiple phone calls to front desk, housekeeping, guest services all went unanswered.. Failed to deliver elevated service as the concierge service in ineffective.. Everything available to you and loved the staff and cleanliness of the whole facility.. Pool was clean and waiters were very helpful, quick and friendly.. Rooms are spacious, comfortable, bathrooms gorgeous, and staff was always helpful.. Hotel location and staff were nice, you are right on the beach, the view is to die for.. Service was fine most of the time even if sometimes a bit aloof.. Gaby, who works at the front desk was very helpful and I look forward to an amazing stay.. The staff was very hard working and pleasant across the board.. If you want to go to the worst hotel with the most horrible service in Miami you found the right place.. When we checked in, Sabrina took exceptionally great care of us.. I cannot say enough about the level of care and service she provided.. I was already a loyal Nobu Miami guest, but Sabrina‚Äôs extra attentive service on this particular trip has really cemented a special kind of love for this place.. I‚Äôve been fortunate to stay at some really nice hotels worldwide, but none of them have come close to this level of genuine hospitality.. I am truly grateful for the Nobu Miami, and particularly for Sabrina‚Äôs empathy and care.. I was called a few hours later to be informed that they were double booked and I couldn't be serviced by the spa manager Juilisa.. She didn't offer a different service, a different time, I explained that I leave at 7am the next day.. The staff is great, I will give them that, but the hotel charges hidden fees at every corner.. The front desk staff was great and very helpful!. I was also expecting some cute chocolate or mints for turndown service, but that didn‚Äôt happen.. The service was pretty good and they were pretty quick when it  came down to getting ice delivered, etc... Excellent room service.. The service at Nobu is unmatched period.. Everything was perfect from day one the staff is amazing.. When we arrived, we were greeted by the valet service, which was efficient, though not necessarily anything special or friendly.. The customer service felt customized and meticulous without being intrusive.. All of our interactions with the front desk staff were excellent.. Phone service is very poor.. Fortunately, we were able to go by the front desk and the staff there was always super helpful.. Eventually, they shared a text service they offer, and I would recommend using it for small service requests during your stay.. The pool was a little lightly staffed (one waitress for the whole Nobu Pool both days), and the hostess was a bit dishonest when discussing gratuities.. The room was beautiful, but there were stains on some of the furniture, though daily housekeeping was immaculate, and our interactions with housekeeping staff we always excellent.. The staff at the entire location was warm and welcoming making sure my stay was a good one.. From the moment we pulled up we were greeted  by valet who took care of us.. The staff was super helpful as well.. The staff was fantastic.. The service was top-notch from arrival to departure.. From the welcome gift in our villa to the service at our private poolside dinner, we couldn't have asked for a better experience.. Room service was great.. Food and beach service was spot on.. The personnel needs training and they need to care more.. Exceptional service across the board no matter what state you are in.. Although this is one of the best hotels that I have stayed in, it was the service that stood out.. Food at Nobu was very good-service very was very good, and front desk was helpful in transportation choices.. Certain things could be a little bit quicker, but Nobu Hotel staff does a great job overall!. I simply have no words to describe how welcoming and nice all the staff are.. Ambiance 10/10, cleaning services are 100/10 as well.. The cleaning staff is doing such an amazing job.. I traveled with my friends and nine out of 10 staff members at the hotel were rude inconsiderate, and most importantly, harassed us.. Horrible Service horrible food horrible stuff horrible experience.. The front desk does seem under staffed and was difficult to contact via telephone.. You can never say enough great things about the staff and how hard they work here.. Banquet staff was incredible from Moe, Isabella, Javier, Paolo.. They all work so incredibly hard to make sure our conference was well taken care off and we didn‚Äôt want for much of anything.. But the beautiful Miami weather made up for a lot - and the hospitality of the staff I mentioned make us come back year after year. For more information, visit https://miamibeach.nobuhotels.com or check reviews online to learn more about guest experiences."
Ocean Reef Suites,"Ocean Reef Suites is a hotel rated 4.0 stars, located at 1130 Collins Ave, Miami Beach, FL 33139-4624. This hotel offers a range from $182 - $287 per night and is ranked #110 of 235 hotels in Miami Beach in Miami Beach. Among its amenities are standard amenities. It has a total of 36 rooms. Key highlights from guest reviews include:  Great service.. It was so helpful!. Really good location, very good beach chair service included, check in process was super fast and easy, staff is so friendly and willing to help in any way they can that it made the whole difference!. The staff was friendly and helpful with all our needs.. Staff is amazing .. Great location, spacious room
Front desk staff Pedro was excellent,very professional and friendly.. Excellent location, exemplary customer service by the entire staff  and very clean accommodations.. Staff was super pleasant.. Well located, impressive rooms, nice staff and all times availability of hot drinks etc.. The staff was pleasant, everyone wore masks however the room was not what I expected.. This suite was really too expensive if this was the quality service provided, I will not be returning.. So it can be fun, but also can be dangerous if you're not careful. For more information, visit http://www.theoceanreef.com/ or check reviews online to learn more about guest experiences."
Pelican Hotel,"Pelican Hotel is a hotel rated 4.5 stars, located at 826 Ocean Dr, Miami Beach, FL 33139-5809. This hotel offers a range from $265 - $454 per night and is ranked #51 of 235 hotels in Miami Beach in Miami Beach. Among its amenities are standard amenities. It has a total of 29 rooms. Key highlights from guest reviews include: There was a short walk to the beach with an abundance of chairs and great scenery.. The suites look amazing with a fantastic view of the Lummus park and the Ocean drive.. We stayed in the Executive Fifties room and loved the space, the view and attention to details. Speedy service, fun environment, great escape from the usual ocean drive crowd.. And also We loved the foods and service given to us during our Breakfast.. The staff, our king suite, the delicious upscale Italian food, and yes, the Aperol Spritzes were exceptional.. Thank you, Pelican staff for treating us like royalty!. The staff and owners were friendly and accommodating, the rooms all had their own theme and were perfectly cleaned, and the scent in this hotel is just amazing.. The best part by far was the amazing customer service which is hard to find in South Beach!. One disappointment though was the lack of hospitality.. Previously, staff had always been welcoming, this time this was lacking.. Just a shame the staff couldn‚Äôt crack a smile and be more welcoming.. Excellent style and decor; fabulous staff.. The hotel, in part because of the staff but also because of the Deisel design, has a very European (Italian, specifically) feel to it.. Close to many bike rentals and staff had excellent recommendations for local restaurants (in addition to their own).. Again, excellent staff and we appreciated our stay.. Great Hotel, Top Location and Fantastic staff and kind service.. The beach service and towels are good and the nightlife around it make it quite unique.. Owners as well as all the employees are extremely kind and helpful and I would absolutely say a special thank you to Anthony, the receptionist.. Services included are amazing and it does not take long until you feel a special guest : free towels for the beach, spot on the beach where you can get a sunbed, the room being checked in the evening and a card with the weather forecast put on the bed with a little something.. Everything a hotel should be...great location, service, deco and food.. The staff was delightful and helpful.. Great location, very friendly and helpful staff, clean rooms, pleasant smell throughout the property.. Lovely staff; especially the guy with glasses at the reception .. he was very helpful.. I requested a room change as my son was scared of a wall ornament and they were totally cool with it.. Anthony and Lawrence at the check in desk was very, polite and helpful.. The entire staff was so friendly and helpful during our stay.. Wendell was very helpful in suggesting just the right room for us.. Front desk staff and valet were friendly and accommodating.. Service, bar and restaurant were all amazing.. Staff at the frontdesk were very helpful, Justin the bartender is a great dude with quite the knowledge of Miami and drinks.. Impeccable service.. Awesome cafe restaurant food is fabulous service attentive can't say enough about The Pelican.. The hotel is done with a lot of love - and this comes to the incredible staff.. They are simply amazing - so excited about this new adventure, so helpful, so friendly.. thank you to the staff for making our stay memorable.. Justin at the bar took great care of us, as did the rest of the staff. For more information, visit http://www.pelicanhotel.com/ or check reviews online to learn more about guest experiences."
Penguin Hotel,"Penguin Hotel is a hotel rated 3.5 stars, located at 1418 Ocean Dr, Miami Beach, FL 33139-4108. This hotel offers a range from $161 - $288 per night and is ranked #103 of 235 hotels in Miami Beach in Miami Beach. Among its amenities are standard amenities. It has a total of 43 rooms. Key highlights from guest reviews include: Basic room, with ¬´back-street¬ª view.. No views for the less expensive rooms but it was pretty quiet.. Our family of 4 stayed here one night on our way to a cruise Jan 1, 2023

We booked a couple of months ago and the only reason I did‚Äôt leave a 5-star review is that the cancellation policy isn‚Äôt flexible, I suggest you make sure you are aware of this before booking.. I would stay here again, and next time would try to book a room at the front of the hotel with a view of the strip.. Read the rest of the reviews - I‚Äôm not alone. Please read all the 1 star reviews!. READ ALL THE ONE STAR REVIEWS!. I got up to my room and it has an amazing sea view and Miami vice charm. Friendly staff, good location, very good breakfast included, served at next door restaurant.. It was horrible and the customer service of the manager was awful.. The room was very pretty and Carmen the receptionist was very nice and super helpful.. David was fantastic, very helpful, and even gave me flowers.. Front desk staff (shout out to David) has been very helpful and pleasant.. The staff was very friendly.. David was very helpful with information on places to eat and drink and visit while in South Beach.. Staff was excellent and went above and beyond to please us.. He was friendly and helpful and truly the bomb.com!!. Staff are amazing.. The staff are amazing and have great customer service!. Carmen was so attentive, helpful and very informative!. Great customer service!. Having said that, our expectations were met and exceeded with the great staff including the wonderful Carmen at the front desk who was happy to print our our cruise boarding passes for us and check our luggage behind the counter until we were ready to collect it on our way to the port.. All the time they look at the phone and FaceTime and they don‚Äôt care about customers.. Room service was good.. They were both super helpful, and pleasant and just added the cherry on top!. Location of hotel was brilliant, small hotel with excellent staff.. Staff were very efficient and friendly; Flavia answered any queries professionally and was happy to help, she was great!. Staff is super sweet.. The service was exceptional and Victoria at the front desk is always willing to help with a smile on her face.. The staff was very professional and were always there to assist.. Can't get a better location, great cost, and an excellent staff, especially Emily and Jeanne.. üôåüíôüëô
Super helpful,  clean place, close to many restaurants and stores!. Staff was very accommodating, we wouldn‚Äôt hesitate going back.. Staff really helpful and friendly.. Elliot the pool guy is quite the character and couldn‚Äôt do enough to be more helpful.. This hotel is an absolute joke, there is not one qualified person working in their entire customer service department.. David was very polite and helpful.. hotel was as described and the service was great.. David was super helpful, friendly, and knowledgeable of the Miami Beach area.. The hotel was exactly as described and the service was amazing.. David was super helpful and aided us in the check in process, specifically showing us the different excursions, stores, and restaurants Miami has to offer.. It has service agreements with other hotels and restaurants.. Very clean, super well located, attention very nice, David at the reception very nice and welcoming as well as the rest of the staff.. The rest of the staff seems to be missing some training!. Thank you to David and the other awesome staff here, you guys are doing great work!. Our house David accommodated us while we waited, was very polite, and just super friendly and helpful.. On our beach day David went above and beyond in taking care of us.. He was super nice and very helpful.. And what made this trip memorable was the great service David provided.. David was very helpful and nice.. The staff was enjoyable from check in.. David was super helpful during our trip.. He has a great understanding of what stellar hospitality means. For more information, visit http://www.penguinhotel.com or check reviews online to learn more about guest experiences."
