name,more_detailed_summary
Sonder The Abbey,"Sonder The Abbey is a hotel rated 4.5 stars, located at 300 21st St, Miami Beach, FL 33139-1703. This hotel offers a range from $141 - $261 per night and is ranked #55 of 235 hotels in Miami Beach in Miami Beach. Among its amenities are standard amenities. It has a total of 50 rooms. Key highlights from guest reviews include: I did read the other reviews and knew that when I booked the stay.. This review is purely about the booking process. Super friendly staff and great location.. After talking to the staff, I was offered another room.. Maria is a very professional , well seasoned hospitality mgr.. Very gracious , kind, patient and helpful.!!!. The staff go above and beyond to make sure you you‚Äôre happy and enjoy your stay :). Maria and friends were extremely helpful.. Very friendly staff who were always very happy to help.. The self serve stations were convenient and all staff members were very helpful and kind.. Great location, incredible service and super clean!. Everyone we encountered at the Sonder were so helpful and kind too, especially Maria!. It‚Äôs in a prime location and the staff is also great, especially Clarke.. He was so helpful and provides outstanding customer service and assistance.. Not a full service hotel but well staffed and always available .. Really nice staff!. Location of this hotel is just awesome, hotel is super clean and staff are most helpful!. The staff is friendly and very helpful specially Maria!. All staff are very warm, friendly and willing to assist without hesitation.. staff is extremely friendly and helpful.. Rooms were very tastefully designed with high quality furnishings, and everyone who works here is super nice and goes out of their way to be helpful.. The staff was friendly, check-in process easy, clean rooms, and location close to the beach was perfect for us.. Great staff.. Very helpful.. It‚Äôs the right level of non intrusive service.. Staff was very personable and accommodating!. Staff helpful and friendly.. Staff were friendly and responsive.. Also, the staff are amazing and so helpful.. There were three staff members this most recent stay who were warm, caring, helpful and willing to go out of their way.. The staff is so welcoming and gracious as well in even allowing guests who have checked out to return and use the lobby and restrooms for changing.. Software very clunky after 4 hours of help from their customer service agent I managed to get it uploaded.. 1 month later I am emailed this morning to tell me that I have to download biometrics again,  Customer service dept advised that they had fallen off their system.. Couldn‚Äôt be bothered with the grief of potential issues so have cancelled booking and made a reservation with a slightly more expensive hotel with a traditional booking system,  feedback to the Sonder, your customer service staff are first rate,  the booking process leaves a lot to be desired.. The Abbey was very nice and the staff went out of their way to get me ice and bring it to my room without me asking for it!. Great location, very clean, very good service.. Helpful staff, clean and well designed rooms, ease of use through the app, and an unbeatable location for walking anywhere you need to be.. There hospitality is awesome.. Perfect location
Lovely staff
Beautiful room
10/10 would recommend!. we couldn‚Äôt have been happier with how the hotel and staff were!. The staff was very polite and well intended.. The internet went out for almost an entire day (the staff was very apologetic, etc, but still...).. The amenities were top notch and the staff were above and beyond excellent.. The staff was very friendly and helpful.. stayed here for 4 days    room has space and good location    easy to go anywhere      good good  and service is awesome       staff are so friendly and nice        have free tea and   coffees      rooms are clean and shower is big and nice area For more information, visit http://www.sonder.com/destinations/miami_beach/the-abbey/c32227 or check reviews online to learn more about guest experiences."
Suites on South Beach,"Suites on South Beach is a hotel rated 4.0 stars, located at 1330 Collins Ave, Miami Beach, FL 33139-4209. This hotel offers a range from $158 - $283 per night and is ranked #105 of 235 hotels in Miami Beach in Miami Beach. Among its amenities are standard amenities. It has a total of 19 rooms. Key highlights from guest reviews include: This review gets a 9! The staff was very friendly and helpful.. Staff wonderful especially William!. Staff were friendly and welcoming as well as efficient, it takes good staff to make a hotel great and both could not be faulted.. Pleasant staff and excellent location.. Lovely staff.. Not only is it safe, clean and comfortable the staff and manager William are amazing as they cater to making everybody‚Äôs stay whether it‚Äôs vacation or for work as comfortable as can be.. Andrea was super helpful.. The valet service was timely and super efficient, and the room was surprisingly huge with a ton of amenities.. He was friendly, helpful, professional, and just excellent all around.. All of the staff was great, really.. Thanks to Andrea she made me and my wife‚Äôs disaster day a breath of fresh air in the end with her endless hospitality.this isn‚Äôt a bad hotel just wasn‚Äôt the place for me and my wife.. Great staff, to mention one was Aaron they were very helpful!. The front desk staff were very friendly and helpful.. Customer service was outstanding.. She was cool down to earth and very helpful.. If you're not looking for a full-service resort-hotel, and instead looking for very convenient, reasonably priced accomodation in the heart of south beach, Suites on South Beach make a great choice. For more information, visit http://www.suitesonsouthbeach.com/ or check reviews online to learn more about guest experiences."
The Betsy South Beach,"The Betsy South Beach is a hotel rated 4.5 stars, located at 1440 Ocean Drive, Miami Beach, FL 33139-4108. This hotel offers a range from $352 - $708 per night and is ranked #7 of 235 hotels in Miami Beach in Miami Beach. Among its amenities are standard amenities. It has a total of 130 rooms. Key highlights from guest reviews include: This is our first review  - taking the time because as a former waitress through college, ( nowadays ""servers"" ), we seldom see this level of service.. We had a room no balcony, supposedly Seaview but the palm trees block this, we enjoyed walking along the boardwalk and meeting other people.. And the keys, especially the Key Largo and the Caribbean bar, drinks for 5 dollars, beautiful view and really nice people.. Every morning at 7:30, I joined the rooftop yoga class, with its beautiful views of the sun rising, followed by a coffee at the Starbucks across the street and a walk on the beach!. It was nicely decorated with green leafy wallpaper, cute, comfortable beds, and a sitting area, but the view left something to be desired. Amazing hospitality from the start.. You will Get taking care of.. Personell is amazing and very helpful in every situation.. The only minus is That i think its overpriced for the room of such quality but overall the staff did amazing job, food is great so i recommend highly The Betsy Hotel for Miami vibe experience. Very helpful staff and thanks to Fritzner and Akhona on reception for great service.. This is our first review  - taking the time because as a former waitress through college, ( nowadays ""servers"" ), we seldom see this level of service.. Most of the staff have been there 5+ years and that makes a valuable difference

At lunch, no charge hot popovers are the bread basket.. From the staff to the food we found the place top notch.. Lovely staff, especially the front desk team (Akhona, Fritz).. Service, food/bev, rooms, pool, we can't say enough.. Art work, books, and excellent service (call out to Evens who was super helpful).. After few days you feel well with an attentive and professional staff.. Excellent service from the front desk and Hendrik when we extended our stay and needed later checkout due to personal circumstances.. Great place staff super friendly loved Fritz and Jackie who always greeted us with a smile.. Two private pools, excellent service and good food options 
A classic location and hotel with a staff that works hard and friendly to accommodate guests. We met a number of lovely, talented, and knowledgeable staff at The Betsy!. Staff are amazing, especially in the restaurant and the guys on the door/assising with luggage (as the road out front is closed).. Jackie and Hendrick on the front desk couldn't be more helpful.. Easily the classiest hotel on Ocean Dr, amazing setting, courteous staff, fantastic breakfasts on the terrace, cocktails can't be faulted (although horrifically expensive), nice pool area (quite exposed when the wind gets up) and spotlessly clean.. The staff are friendly and tea and coffee in room was a bonus.. Great service, check in, room, dining, evening jazz, wonderful front desk.. Special shout out to Jackie at the front desk for excellent service.. The Staff was so friendly.. Also a big thank you to 
Jonathan Plutzik who is always interesting and helpful.. Excellent service between the front desk, concierge, and bar/restaurant.. Enjoyed rooftop pool with bar service.. Every member of the Betsy South Beach staff went above and beyond to ensure our stay was fantastic!. Juan, Art Barraza (Concierge), Paul Drecq (Concierge), Esra and Fritzner at the Front Desk especially provided us with such exceptional customer service throughout our stay for which we were most appreciative!. Staff are friendly when engaged but they are generally busy.. Nor was the level of service at this price point.. Classy gem of a hotel in South Beach Miami with direct beach access, amazing amenities and wonderful service & staff.. We return every year to this elegant hotel with the friendliest, most amazing staff.. Their attention to service and to their guests is truly wonderful!. Staff was really nice and the rooftop pool was great!. All the staff we met were friendly, approachable and helpful but a special mention to Ezra on the front desk, and the two superb concierges Art & Paul.. I would especially like to mention the hotel staff.. I travel a lot with my boyfriend and we have not yet met such courteous service anywhere.. Top notch- live music, the staff, at least 3 grand pianos and live music every evening during our stay.. The location, restaurant, rooms, staff, etc.. Service was impeccable.. Service and staff were above and beyond.. ), and friendly hotel staff, who greeted us with champagne and beverages for our children.. The pool was well staffed, had a great menu and a nice vibe‚Ä?great play list, which ties in with the nostalgic rock n‚Ä?roll photos that grace the hotel walls. For more information, visit http://www.thebetsyhotel.com/ or check reviews online to learn more about guest experiences."
The Confidante Miami Beach,"The Confidante Miami Beach is a hotel rated 4.5 stars, located at 4041 Collins Ave, Miami Beach, FL 33140-3713. This hotel offers a range from $247 - $420 per night and is ranked #52 of 235 hotels in Miami Beach in Miami Beach. Among its amenities are standard amenities. It has a total of 354 rooms. Key highlights from guest reviews include: My husband was disappointed that we didn't have a balcony or ocean view  (no upgrades happened to be available at check-in for Hyatt Globalists), BUT I didn't mind it with the skyline in the distance and pretty sunsets!. The view from our room was amazing.. The rooms are clean and have nice ocean views.. My room was a 2 queen bed with partial ocean view balcony. Facilities, service and room were three star quality at best.. Checked in at 4pm, only to find out pool and beach services end at 5pm.. Bar and restaurant service staff were indifferent.. He has taken care of me with setting up the cabana or bringing my lounge to the perfect spot.. The staff was very friendly.. Staff from the pool to the bar to the restaurant to the lobby were all very friendly, helpful and they work extremely hard.. The hotel in general is run down and in need of a major rehabilitation, the majority of the staff encounters were less than pleasant, the rooms were small and the walls were paper thin (next door unit had a person up all night coughing and throwing up).. We reserved a cabana at the pool and the service was tops.. Our server G took great care of us.. We experienced great service with Khan on the beach and the lounge.. He was so friendly and helpful.. We stayed for 5 nights and even had great service during a rainstorm.. If you have an appreciation for history and classical elegance, this is your spot
Service was great across the board.. It rained almost the whole time but we still enjoyed ourselves with our fantastic food and beverage service from Smart!. Option of beach or pool- it was busy so the pool was packed, the staff on beach got us chairs and umbrella!. Staff was very helpful and friendly also!. The staff were amazing.. so friendly and helpful.. The front desk staff was very helpful and allowed us an extended check-out.. Made very welcome by guest services, door staff very helpful, rooms ready on time and very clean, nice location straight on to the beach, bar staff also smart clean and helpful,we had a problem with the room lock that was fixed in minuets could not ask for more, will stay here again. The staff if helpful and friendly.. The service and staff were excellent (Andy was wonderful by the pool).. Had the absolute pleasure of being taken care of beachside by Malik.. Malik showed professionalism, compassion, and understood how to care of the guests.. The thing that stood out the most was the customer service.. I‚Äôve stayed in countless hotels and  I‚Äôve never experienced customer service like this for missing items.. The staff on the beach couldn‚Äôt do enough for us - a big shoutout to CHRIS V and his team.. The service team is fantastic.. Pool to restaurant and all around everyone was so helpful and caring.. There are 2 heated pools (separate for kids/families) with full service bar/food.. You can walk right out to the beach where you get complimentary beach service, water, and full bar/food service.. We have stayed here many times, and have always found the staff to be friendly and helpful!. The Confidante has excellent staff who provide superior service.. The staff was SO friendly- every single person I encountered spoke.. I was there for a work conference and the event staff was terrific and the food was DELICIOUS!. Visited the beach side of the hotel and encountered great service!. Awesome pool bar/food service!. Anazing costumer service, i appreciated the extra care and it was fun time.. the beach staff were quick to cater and bring our food and drinks.. great costumer service, i appreciated the extra care and it was fun time.. the beach staff were quick to cater and bring our food and drinks.. The staff is very helpful with beach chairs and umbrellas with 2 chairs included with your room.. Friendly staff.. Very limited room service menu.. The staff was always polite, helpful and friendly.. The pool staff and beach staff, especially pleasant.. Room service not turning up.. Nice vibe, great location, friendly staff and very clean.. The staff at the beach was great, nice lounges and umbrellas, great food service too!. This was our first time staying here, and the service was timely and welcoming.. They were friendly , very helpful, and happy/enthusiastic to assist us.. The staff were very pleasant and professional.. I booked through Amex Travel and was able to get a complimentary room upgrade and $100 credit to use towards food, services etc.. Also very clean and the staff is amazing!. The service was great, I enjoyed my day , Dalvin, Octene, Sal, and Markelle were really helpful on the beach.. If you are ever in Miami visit the confidante hotel there service is prompt and oriented, I will be back.. The staff were so friendly. For more information, visit http://theconfidantehotel.com or check reviews online to learn more about guest experiences."
The Fritz Hotel,"The Fritz Hotel is a hotel rated 4.5 stars, located at 524 Ocean Dr, Miami Beach, FL 33139-6616. This hotel offers a range from $168 - $293 per night and is ranked #56 of 235 hotels in Miami Beach in Miami Beach. Among its amenities are standard amenities. It has a total of 22 rooms. Key highlights from guest reviews include: The rooms had bad views and I had to keep the drapes closed the whole time, or neighbors could stare in ... but who cares because the beach was literally across the street!. Although the pool is small the views of the ocean are great ... and there would be a lot of space to relax.. We had high hopes but were terribly misled by the glowing reviews.. I simply can't reconcile those reviews with our unfortunate experience.. We booked an Ocean View Suite with 1 bedroom and kitchen and looked forward to our winter getaway vacation.. If you want more details, you can view photos or read extended comments further below.. I like the views and the pool area that they have here.. This place was so nice just make sure you try to book a full ocean view.. I had a one bedroom with a partial view. The staff is great here.. The rooms had bad views and I had to keep the drapes closed the whole time, or neighbors could stare in ... but who cares because the beach was literally across the street!. Nice staff, great rooms and we walked everything.. Stayed for 3 nights and were very impressed with the room and the staff.. The Argentinian guy on reception (assistant manager) was particularly friendly and helpful.. It is painfully obvious that ownership has set up their staff to fail, leaving them with no resources, inadequate amenities, and not nearly enough staff.. There was a single employee on staff from 5pm until the next morning.. She really tried to help, but was obviously overwhelmed, under-supplied, under-trained, unsupported and simply unable to provide even basic customer service.. I do wish him well and hope that ownership supplies him with adequate staff and resources to make the hotel more successful in the future.. We booked to stay here in April 2022 but had to cancel the booking in January and should have received a refund of our $500 deposit but to date and after many emails and phone calls I have yet to receive a refund - be very careful!. In fact, service from the hotel staff in general was very good.. Great location, very clean, staff is always eager to help you.. The staff here is very friendly and accommodating to make sure that you have everything that you need.. Manny is not nice neither is his staff they all threatened to cancel our stay.. The manager Manu was very friendly and helpful, he let me do a late check out which was great and contributed to a great hotel experience.. I didnt but the guy at the front desk was so helpful and discounted my stay because of this. For more information, visit http://www.thefritzhotel.com or check reviews online to learn more about guest experiences."
The Gates Hotel South Beach - a DoubleTree by Hilton,"The Gates Hotel South Beach - a DoubleTree by Hilton is a hotel rated 4.0 stars, located at 2360 Collins Avenue, Miami Beach, FL 33139-1604. This hotel offers a range from $189 - $349 per night and is ranked #20 of 235 hotels in Miami Beach in Miami Beach. Among its amenities are standard amenities. It has a total of 235 rooms. Key highlights from guest reviews include: They needed to do better than this than a view of a wall. She is the main reason we come to the Gate hotel due to her outstanding hospitality!. Very nice hotel with a professional team that provided excellent service for my entire 4-night stay.. Wendy was so sweet and professional, great hospitality.. I was also delighted to find a very helpful beach attendant named Christian who was kind enough to set up a bed, and show me where the jet Ski's kayaking and water sports were located.. The gates was such an amazing experience, the staff ,the lobby, the bathroom, and beds were amazing so clean and professionally decorated I even got to meet an amazing person who assisted me during the beach his name was christian and he was so professional setting up a bed for me and recommending me to all the amenities.. From the bottom of my heart thanks you so much gates hotel staff üôè. We called and they were so helpful in helping us find a room for us.. One of the hotel workers at the beach, Christian, was very helpful and accommodating at the beach.. Staff was top notch.. Service was exceptional.. Eloisa took great care of us even texted to chk on us to make sure everything was ok. She was more than willing to help assist with making sure my daughter enjoyed her birthday stay.. Thanks to her, I can say that the hotel has a pleasant and welcoming staff.. Front desk staff is not friendly when we complained on behalf of the 50 person party wedding that stayed there she replies with snotty remarks.. The staff is dedicated to ensure you have nice stay which stems from the Management empowering the team.. Excellent, clean hotel with friendly staff, fun games for kids, great pool, and perfect location!. Carolina, Elo√≠sa, Briam, and Sof√≠a were super-helpful and welcoming.. Beach access was perfect and Christian was so helpful getting us everything we needed for an amazing beach day!!. The customer service was spectacular from the moment we arrived.. Wendy and Vanner took very good care of us at the pool and Lobby bar.. The beach was only 2 blocks away and staff on the beach were incredibly kind and accommodating.. Rooms are clean and house cleaning service is excellent and friendly.. Food was excellent and drinks were refreshing and the staff made us feel welcome and made sure it was the perfect stay.. The staff here are truly and genuinely caring, kind, and considerate!!!. The three staff members I interacted with, Sofia, Frank, Eloisa, went above and beyond to make sure our stay here was ideal!!!. We will definitely return some day because of the excellent service.. I had √† very Nice exp√©rience in this h√¥tel, with good food and service from the best waiters Hector Garcia that i recommand 100% for their kindness .. Reception staff extremely polite and helpful.. Staff was so friendly and helpful.. Many many thanks to Andrea, Bob and Elouisa for their hospitality and help with restaurants and other things to do ... we felt like local's !!!. I stayed here for the weekend with my gf and we received the most amazing service.. It was truly five star service.. I‚Äôm here for the weekend, the service was amazing, front desk people were really helpful.. The service at the pool was great, Wendy was really helpful and took really good care of us an
We will be back for sure!. The staff is really nice and always willing to help.. They seemed to be training a staff member.. The refillable water was warm and the QR Code for room service does not provide the correct menu.. Our breakfast was made extra special by the wonderful staff ‚Äîparticularly Luis Balboa, whose smile friendliness and professionalism started our day out perfectly.. The service here was outstanding.. We enjoyed so much the amenities, service and all the staff!. Truly hospitality was above and beyond. The beach setup is perfect and the staff are amazing and so accommodating. For more information, visit https://www.hilton.com/en/hotels/miamhdt-the-gates-hotel-south-beach/?SEO_id=YEXTN-AMER-DH-MIAMHDT&y_source=1_MzcxMzgwMy03NjktbG9jYXRpb24ud2Vic2l0ZQ%3D%3D or check reviews online to learn more about guest experiences."
