name,more_detailed_summary
KAYAK Miami Beach,"KAYAK Miami Beach is a hotel rated 4.5 stars, located at 2216 Park Ave, Miami Beach, FL 33139-1722. This hotel offers a range from $199 - $333 per night and is ranked #48 of 235 hotels in Miami Beach in Miami Beach. Among its amenities are standard amenities. It has a total of 50 rooms. Key highlights from guest reviews include: I've read some of the reviews about the noise at this hotel.. Tucked between a vacant lot surrounded by chain link fencing and filled with trash and landscape debris and an alley filled with overflowing garbage cans.. Ah, last but not least, the ‚ÄúCourtyard View.‚Ä?This is an insult to the intelligence.. I had a fairly decent stay, but it was NOT as close to certain activities as some of the reviewers made it seem.. I stayed on the 1st floor and although some reviewers complained of noise, I had NO such issue.. We want to leave a positive review for the kind staff at kayak hotel for all they did to make our stay complete.. In fact this is my very first review ever.. I was misled by the positive reviews on Tripadvisor for this hotel that I find hard to believe are legitimate,  Because I had a work conference at the Convention Center I chose this hotel because it was only 10 minutes away & had good reviews.. There‚Äôs a bar plus the restaurant on the main level which outdoor dining with a view.. There are lots of plants but also good views of the surrounding area. Water pours from the electrical light fixtures on the ""rooftop terrace"" whenever it rains, the front desk is almost always unattended, no room service for 7 nights even with placard hung requesting same.. The staff is very accommodating.. She is so knowledgeable and helpful and her recommendations were on point!. Staff at the hotel and the restaurant (layla) were very friendly and helpful.. As we checked in we were greeted by Essence and Marge who were extremely friendly and helpful!. I knew we were headed downhill when a very nice man, located near what appeared to be a front desk, told me that check in was ‚Äúself service.‚Ä?HUH?. It‚Äôs a  deflating, and depressing reality in our world: Human kindness, personal interaction, the feeling that you are literally someone‚Äôs ‚Äúguest‚Ä?is disappearing--not just from  the hotel industry but the service industry in toto.. Personal, charming front desk staff.. All of the comfort , easy style and service delivery of those big brand boutique hotels (yes you know the ones ), but without the pomp or stuffiness that can go with them.. Thank you Albert, for your kind hospitality and to be  present for any needs.. Although there was only 1 roll of tissue in the room upon my arrival, staff was pretty good about bringing another roll when asked.. Staff was very friendly and welcoming.. I had that issue and since I had to do that I did not get housekeeping services done because I put the request on the old reservation.. Loved the ambiance, vibe and the customer service.. Always helpful, accommodating, great energy and looked out for us the entire time we were there.. I loved the carefully curated attention to detail from the signature scent that greets you each time you enter the lobby, the music playlist was always a vibe,  daily fruit infused water to the luxury brand toiletries in the bathrooms.. From the moment we arrived the night manager, Larry took excellent care of us.. All of the staff , from the front desk, restaurant, bar to housekeeping were genuinely friendly, hospitable and made us feel comfortable .. We want to leave a positive review for the kind staff at kayak hotel for all they did to make our stay complete.. We spent time chatting with some of the other staff and bartenders such a Daniel, Arie and Max who were absolutely incredible to us.If you have the opportunity to stay here- don't pass it up!. We are still reminiscing about our experience and talking about how awesome the staff was who work there.. The employees and staff really do make all the  difference....Thank you!. Being a little of an older gent i always let me wife take care of these sort of things.. I say all this because i appreciated every aspect of the care the Kayak flagship hotel has created with an amazing staff.. If i were in the hospitality business i would do everything i could to hire the away and pay top wages because they are the reason this new concept will thrive.. Well, the welcoming was great, Kim made my check in with an smile & helpful, I would love to try restaurant and pool in next few days that Kim highly recommend me!. Although it‚Äôs a boutique hotel, the restaurant Layla was amazing, staff incredibly helpful and friendly, and room very comfortable.. The waiter agreed and actually took our order but come on - we pay for a service not a self-service.. Staff were very nice but they no longer really have jobs they just get to stand around helping you when the digital world doesn‚Äôt work.. Super helpful and warm.. Ask for Federica at the reception she‚Äôs super sweet and helpful!. The hotel, room, staff and restaurant are incredible.. Additionally, the entree I ordered from room service was out so he updated my dinner to a ribeye feast at no additional charge.. The dude knows what ‚Äòhospitality‚Ä?is all about!. The staff were helpful and friendly.. The staff was excellent, the space was so chic, restaurant was amazing and it felt like our home away from home.. Kim was very helpful and the reason of our exceptional stay.. The whole team is nice and helpful, can‚Äôt thank enough the lovely Federica.. Friendly, attentive, helpful and professional.. The staff is very polite and welcoming.. Best Hotel in Miami Beach,Albert and the staff were very helpful, wonderful customer service, the Morocan Vibe, the rooms, the restaurant, roof top, everything was amazing!. The staff was warm and helpful.. All staff members I interacted with were very kind and professional.. In particular, the in-hotel cafe ""Layla"" was a wonderful vibe - food, staff, ambience, music, really made our stay extra great.. The bathroom door did get stuck if you closed it all the way and our TV didn't work except for half a day the whole week we were there but those issues were overshadowed by the WONDERFUL staff, from the Hotel Manager down the line, EVERYONE was super friendly and always helpful.. Albert (the Manager), Patrick (hotel staff) and Sania (Layla restaurant) are particular standouts.. On weekends, guests are able to order room service since the bar and restaurant are very popular. For more information, visit http://KAYAKmb.com or check reviews online to learn more about guest experiences."
Kasa El Paseo Miami Beach,"Kasa El Paseo Miami Beach is a hotel rated 4.5 stars, located at 405 Espanola Way, Miami Beach, FL 33139-8152. This hotel offers a range from $130 - $229 per night and is ranked #37 of 235 hotels in Miami Beach in Miami Beach. Among its amenities are standard amenities. It has a total of 71 rooms. Key highlights from guest reviews include: We read some reviews about noise during the night, but our room was at the end of Espa√±ola Way, and was a normal one.. The television had to pair with your phone and use your own app to view.. I also wish that we would have gotten one of the rooms on the outside with some sort of view, our only view was of the the windows of other rooms.. It is in the core of south beach, next to public transportation (going to airport or downtown in about 25 min), two corners away from the beach, directly next to the best restaurants with highest reviews of all south beach.. But, I spent most of my time in the bedroom relaxing on the king bed while viewing the large mounted television.. The view of a parking lot and an overgrown palm tree.. When we asked for a room with a view (after checking the website for availability, which they had) we were told,  NO.. We said we would like a view, since the price is the same, and were told it would be noisy if we got a balcony.. We understood that but only wanted a decent window view instead of a dark ""courtyard"".!. When they finally got into their room, the landscapers were having a great time yelling over the leaf blowers, which was directly  outside the small window.. RUN AWAY TO BETTER  HOTELS WITH A VIEW!. We enjoyed the wine social hour on their (small but great view ) balcony overlooking Espanola st. It is true that there is no a front desk agent on site and no housekeeping service daily but who needs all that, I loved the roku attached to the tv where you can watch the news and any internet service you may belong to, also there is a small living room.area for you to enjoy with a microwave and a balcony to relax and have a drink.. He was so friendly and helpful and made sure to always ask if I needed anything else in the room‚Ä?more coffee, bath towels, beach towels, etc.. The communication was amazing, anything you need, they will take care of you, I even asked for an early check out at 1pm, and no problem, they provided that.. Despite these couple of things, I would still say that our experience overall was good, the virtual front desk was simple/easy, the staff were always attentive and replied back almost immediately to text messages and were helpful, polite and courteous.. The parking garage does not offer in and out service like the valet.. This is called dishonesty, not to mention horrible customer service.. We met the staff at a Meet and Greet.. Price are really low compared to the other hotels and this is probably because they removed all unnecessary things that are costly: you don't have a person in the lobby 24 /7, they don't have room service, housekeeping etc.. So their service is still amazing and personalised despite a virtual lobby.. Friendly and courteous staff, stairs to third floors added to the charm.. Hotel customer service was 6 out if 10.. Only two staff were extremely helpful.. The neighborhood felt safe and the staff was friendly and always available.. The rooms were clean and the staff friendly.. Was immediately impressed by the employees, Daniel and Ignacio were always so helpful and very kind.. The staff is friendly and attentive.. Best part of this hotel is the fantastic staff.. Good for business, vacation, or romantic getaway and the staff will accommodate your needs.. From check-in to check-out, service was impeccable!. Khalil,  Daniel and Katherine provided outstanding customer service.. Staff was friendly.. The staff is very professional, kind and my thanks to Khalil that was very helpful providing hints and reservations for Miami.. The staff were also very nice and the room I stayed in was spacious, comfortable and well designed.. Service and rooms are 5 STAR!!!. The staff at the hotel were sooooo friendly and helpful from the moment we arrive to when we left.. We were very pleased with the location and the service received at this hotel.. The staff was genuinely interested in our stay and made sure we were taken care of.. Staff was friendly and helped with carrying luggage as there are no elevators.. THEY SIMPLY DON'T CARE ABOUT THE COMFORT OF THEIR GUESTS.. We loved the wine hour and the beach chair service.. Most importantly, the service was impeccable.. If you are seeking the friendliest, most attentive staff; an immaculately clean hotel; and an affordable and fun little get-a-way in the heart of South Beach... go to El Paseo!!. Malwine, the receptionist is the sweetest and was very helpful with everything.. The accommodations are fantastic, the staff is always courteous and helpful whether it's a personal issue or assisting our team with commercial requests.. And, the front desk staff was very obliging - courteously insistent in bringing our luggage up the 3rd floor in this elevator-less hotel.. Specifically, they are continuing to use the virus as an excuse for NO or severely reduced and erratic room services.. Upon check-in, we were advised that normal room service was not available.. It has become obvious that this hotel is using the pandemic for an excuse to not hire replacement housekeeping staff following illness and normal attrition losses.. But service - Poor.. If they want to cut staff, don't continue to charge double and triple the room price for a weekend stay.. The service was top notch, friendly and professional.. Excellent staff, accommodations, location.. The staff were all so nice and helpful.. It is a boutique hotel that sits smack dab in the middle of the busiest party street on south beach so you wouldn‚Äôt know how clean the hotel is, how courteous and how accommodating the staff is unless you saw it for yourself.. OH‚Ä?last thing‚Ä?. their rooms are even moderately priced; you can‚Äôt find this kind of value, cleanliness, location, party atmosphere, and service anywhere else on SOBE right now, and especially for this price, PERIOD! For more information, visit https://kasa.com/properties/kasa-el-paseo-miami-beach?utm_source=Tripadvisor&utm_medium=nonpaid&utm_campaign=BusinessAdvantage&utm_term=VisitHotelWebsiteButton&utm_content=PAS or check reviews online to learn more about guest experiences."
Kimpton Angler's Hotel,"Kimpton Angler's Hotel is a hotel rated 4.5 stars, located at 660 Washington Avenue, Miami Beach, FL 33139-6208. This hotel offers a range from $214 - $402 per night and is ranked #35 of 235 hotels in Miami Beach in Miami Beach. Among its amenities are standard amenities. It has a total of 132 rooms. Key highlights from guest reviews include: The rooftop pool is spacious with attentive towel service and city views.. As others point out in their loft suite reviews, Room 116 felt humid and musty, and the bathrooms have not been updated and do not look like the ones in the marketing photos.. Other reviewers have pointed out that the new building is in better shape than the loft suites or the rooms located in the Seawell Fish & Oyster building.. I do not usually leave reviews but the service was but the staff at Kimpton really went above & beyond.. In fact, I have never had such a bad experience at any property before that I felt the need to write a review.. Reading the reviews of the Kimpton Anglers, they are mostly positive.. However there were not any kind of views but walls or windows.. As it was our anniversary  i booked a premium king with balcony and asked for a room with a nice view,  the hotel upgraded us to a spa suite, & there was a bottle of wine and small crackers and spread gift which was a lovely thought and really appreciated, and also as IHG members we were able to check out at 2pm. Luciana at the front desk is incredibly knowledgeable and helpful.. The rooftop pool is spacious with attentive towel service and city views.. Food and beverage staff were friendly.. Morning coffee service was conveniently served in Seawell Fish & Oyster.. CONS:  This is a high-traffic property that feels understaffed.. Staff knowledge and helpfulness was uneven at the front desk (Luciana was great, her male colleagues less so).. Rooftop pool bar and food coverage was short-staffed and not always immediately available.. Staff acknowledged room maintenance issues had been previously reported but not addressed, including a broken cabinet door that had caused floor damage and shower drainage issues in Room 309.. Guest services responded to text message requests, although sometimes reminders were needed and it took more than an hour or two for things that were desired quickly, (e.g.. Very clean hotel, friendly staff and its location is perfectly placed in South Beach.. The hotel is great and right on par for a well appointed Kimpton, but what made this hotel 5 star was the AMAZING staff!. I cannot say enough positive things about how client focused, kind, fun and caring the Angler's staff all are.. I have worked in high-end hospitality for 2 decades and there is nothing better than being acknowledged and treated with courtesy.. Whereas this should be the norm, it is now becoming the exception and when I encounter 5 star service, I do not forget!. They took care of us when we arrived at 3am UK time and especially when my husband had to go to hospital!. They made everything feel like it would be ok. All the staff here are polite and cannot do enough for you.. Our room was lovely and great for our family of 4, brunch was great, and we loved the location, close to the beach whilst the pool with its complimentary towels and great bar service was a hit with our teens who liked the music and vibe!. This is a great Miami Beach hotel which is superbly run by people who care about great service.. Never got service or a drink as bar staff to busy partying amongst themselves.. THANK YOU WONDERFUL STAFF OF KIMPTON ANGLER HOTEL FOR A WONDERFUL STAY AND FOR OVERNIGHTING A PIECE OF JEWELRY I LEFT IN THE SAFE!. After coming home, we received a phone call from the staff about an item left behind.. Great hospitality, great people and new/clean rooms!. The hotel has complimentary towels and Banana Boat Factor 50 sunscreen available, as well as chilled water on the pool deck
We did not eat in the hotel, but they have a happy hour every evening for free drinks
I must make a special mention to the reception staff, who assisted me when I realised, when I had passed security at the airport, that I had left my iPad in a drawer in the hotel room.. All staff go above and beyond to provide the best service - and then go beyond that.. The Staff were so amazing!. 
What a great Hotel to stay in, we were so well looked after and the staff were always available to help.. Exceptional service even before we arrived.. That said all of the staff were excellent thank you‚Ä¶The hotel is just perfect, the bar area and  pool areas are incredibly relaxing .the hotel is in an ideal position for South Beach‚Ä¶I can‚Äôt imagine there is a better place to stay‚Ä? I do not usually leave reviews but the service was but the staff at Kimpton really went above & beyond.. Hossain, Chawki, Gabriel & Luciana were all pleasant and super helpful.. We stayed here for a girls' weekend & it was a carefree trip in large part thanks to their welcoming attitude.. The beds were comfortable, the cleaning service is impeccable and the rooftop pool is a great place to lounge around.. Even though they offer free coffee/tea in the morning and a wine bar in the evening, what is the point if the service is so terrible and the room is of a 2 star quality.. Staff was very attentive.. Hussein and Chawki were super helpful in making sure I was happy with my room as well as my entire stay.. From the friendly and most helpful front desk staff to the great location, the cleanliness, the pleasant atmosphere, the stylish, chic decor, it all adds up to perfection.. The staff were really good and arranged for us to have a late check out even though they were extremely busy.. Two areas of improvement‚Ä?higher quality of pillows (surprisingly were not up to Kimpton standard) and room service would be nice.. The staff at reception was super helpful and extremely friendly.. Staff is friendly and helpful.. Fast service.... Thank you to all the staff.. The room was clean and very comfortable (although I was not in the room much during my trip, I don't travel to stay in a room),  the staff were all very nice and friendly.. Chris the manager was helpful with giving recommendations in the area, reallynice guy that helped made the trip special.. Service was slow and begrudging.. Not much was offered at this hotel in the way of charm, information or hospitality.. Super friendly and attentive staff
Very cosy reception area with self served lemonade and water.. The staff¬† here is fabulous and helpful.. Next we meet the outgoing truly helpful Madeline¬† whom served wine during wine hour from 5pm to 6pm outside in the court¬† area.. The service from pretty much every employee sucks.. He looked at me quizzically so I asked, ‚ÄúCan you take care of our baggage?‚Ä?He says he can and fetched a cart.. Other than adequate lodging , the level of service we received is what I would expect at a Red Roof Inn, not at a Kimpton property charging premium rates.. Super friendly staff, Nice amenities and complimentary bag with beach towel and you can ask for an umbrella to borrow.. Also a shout out to Hussain who was so helpful.. I will do return to this hotel for the staff
The rooms are clean and pleasant and location is great. Front desk staff were all very kind and helpful, especially Anthony who was very professional yet extremely personable!. As well as the staff.. Their service is excellent also.. Clean and great staff.. Special mention to Hussein for the excellent service...... I showed the front desk staff pictures of the hairs and asked to have the bathroom and specifically the tub cleaned.. The rooms are nice and spacious .. it‚Äôs the second time I stay there only because the front desk staff were beyond helpful.. a guy named hussien went above and beyond to make sure my stay is pleasant .. gave me the exact kind of room I was looking for and catered to the fact I‚Äôm a  man that needs his privacy during his stay.. I‚Äôd definitely stay here again when in Miami .. no surprises were there .. you get what you see online. True professionals - always eager to help and deliver top notch service with a smile.. The staff are really lovely and helpful, however on returning to the UK i have now had an odd charge added to my CC on the day after check out!. As a top IHG Member, me and my group was WELL taken care of during our stay!. Unfortunately, the ground level pool was out of service during our stay but we found the time to utilize the rooftop pool. For more information, visit https://www.anglershotelmiami.com/?cm_mmc=YextLocal-_-cp-_-US-_-ANGL or check reviews online to learn more about guest experiences."
